{"spec_id":"SPEC-FALLBACK-1","version":"1","source_ids":["REQ-1"],"non_goals":["No unrelated refactor"],"behaviors":{"positive":["Authorized request succeeds"],"negative":["Unauthorized request is rejected"],"boundary":["Empty optional input is accepted"],"failure":["Dependency failure is observable"]},"acceptance_criteria":[{"criterion_id":"AC-1","test_id":"TEST-1","observable":"Command exits zero and emits the expected record"}],"tasks":[{"task_id":"TASK-1","depends_on":[],"write_scope":["src/domain-a"],"verification_commands":["python -m unittest"]}]}
